{
  "$schema": "http://json-schema.org/draft-07/schema#",
  "title": "Teranga Shield — schéma commun des jeux de données de scénarios",
  "description": "Schéma partagé par patterns_fr.json, patterns_en.json et patterns_ru.json. Chaque fichier doit couvrir les mêmes 4 catégories, avec des formulations propres à sa langue (pas une traduction littérale). Ce fichier est un document de référence, il n'est pas chargé au runtime.",
  "type": "object",
  "required": ["language", "schemaVersion", "categories"],
  "properties": {
    "language": {
      "type": "string",
      "enum": ["fr", "en", "ru"],
      "description": "Code de langue ISO 639-1, doit correspondre au suffixe du nom de fichier."
    },
    "schemaVersion": {
      "type": "integer",
      "description": "Incrémenté à chaque changement de structure (pas à chaque ajout de phrase)."
    },
    "categories": {
      "type": "object",
      "description": "Les 4 catégories de scénario, communes aux trois langues.",
      "required": [
        "TRUST_BUILDING",
        "FABRICATED_URGENCY",
        "SENSITIVE_INFO_REQUEST",
        "INSTITUTION_IMPERSONATION"
      ],
      "properties": {
        "TRUST_BUILDING": { "$ref": "#/definitions/patternEntryList" },
        "FABRICATED_URGENCY": { "$ref": "#/definitions/patternEntryList" },
        "SENSITIVE_INFO_REQUEST": { "$ref": "#/definitions/patternEntryList" },
        "INSTITUTION_IMPERSONATION": { "$ref": "#/definitions/patternEntryList" }
      }
    },
    "legitimateContextAllowlist": {
      "type": "array",
      "description": "Formulations légitimes à forte charge émotionnelle (hôpital, banque, employeur) qui doivent atténuer le score plutôt que le renforcer — voir la contrainte 'faux positifs'.",
      "items": { "$ref": "#/definitions/legitimateContextEntry" }
    },
    "keywordSignals": {
      "type": "object",
      "description": "Complément par mots-clés aux phrases entières de 'categories', trop strictes pour du langage courant (SMS, discours improvisé). Clé = même 4 catégories.",
      "properties": {
        "TRUST_BUILDING": { "$ref": "#/definitions/keywordSignalRuleList" },
        "FABRICATED_URGENCY": { "$ref": "#/definitions/keywordSignalRuleList" },
        "SENSITIVE_INFO_REQUEST": { "$ref": "#/definitions/keywordSignalRuleList" },
        "INSTITUTION_IMPERSONATION": { "$ref": "#/definitions/keywordSignalRuleList" }
      }
    }
  },
  "definitions": {
    "patternEntryList": {
      "type": "array",
      "minItems": 1,
      "items": {
        "type": "object",
        "required": ["phrase", "weight"],
        "properties": {
          "phrase": {
            "type": "string",
            "description": "Formulation caractéristique de la catégorie, rédigée nativement dans la langue du fichier (pas une traduction mot à mot)."
          },
          "weight": {
            "type": "number",
            "minimum": 0,
            "maximum": 1,
            "description": "Contribution au score si la phrase (ou une formulation proche) est détectée dans le texte transcrit."
          }
        }
      }
    },
    "keywordSignalRuleList": {
      "type": "array",
      "items": {
        "type": "object",
        "required": ["weight", "groups"],
        "properties": {
          "weight": {
            "type": "number",
            "minimum": 0,
            "maximum": 1,
            "description": "Contribution au score si la règle se déclenche."
          },
          "groups": {
            "type": "array",
            "minItems": 1,
            "description": "La règle ne se déclenche que si CHAQUE groupe a au moins un terme présent dans le texte (co-occurrence). Un seul groupe = déclenchement sur simple présence d'un terme ; deux groupes ou plus = exige que les deux types de signaux apparaissent ensemble (ex. un verbe de demande ET un terme sensible), pour éviter qu'un mot isolé et courant déclenche une alerte à lui seul.",
            "items": {
              "type": "array",
              "items": { "type": "string" }
            }
          }
        }
      }
    },
    "legitimateContextEntry": {
      "type": "object",
      "required": ["phrase", "dampens"],
      "properties": {
        "phrase": { "type": "string" },
        "dampens": {
          "type": "string",
          "enum": [
            "TRUST_BUILDING",
            "FABRICATED_URGENCY",
            "SENSITIVE_INFO_REQUEST",
            "INSTITUTION_IMPERSONATION"
          ]
        },
        "dampenFactor": {
          "type": "number",
          "minimum": 0,
          "maximum": 1,
          "default": 0.5,
          "description": "Facteur multiplicatif appliqué au score de la catégorie visée quand ce contexte légitime est détecté."
        }
      }
    }
  },
  "categoryDescriptions": {
    "TRUST_BUILDING": "Mise en confiance : l'interlocuteur établit une relation de confiance avant d'introduire une demande.",
    "FABRICATED_URGENCY": "Urgence fabriquée : pression temporelle artificielle pour empêcher la victime de réfléchir ou de vérifier.",
    "SENSITIVE_INFO_REQUEST": "Demande d'information sensible : code OTP, mot de passe, numéro de carte, identifiants.",
    "INSTITUTION_IMPERSONATION": "Usurpation d'institution : se faire passer pour une banque, une administration, un opérateur télécom, la police, etc."
  }
}
