{
  "language": "ru",
  "schemaVersion": 1,
  "categories": {
    "TRUST_BUILDING": [
      { "phrase": "я ваш персональный менеджер", "weight": 0.35 },
      { "phrase": "мне поручили заняться именно вашим делом", "weight": 0.4 },
      { "phrase": "можете мне доверять, я работаю в", "weight": 0.4 },
      { "phrase": "мы заметили подозрительную активность по вашему счёту", "weight": 0.45 },
      { "phrase": "не волнуйтесь, я здесь чтобы вам помочь", "weight": 0.3 }
    ],
    "FABRICATED_URGENCY": [
      { "phrase": "вам нужно действовать прямо сейчас, иначе счёт заблокируют", "weight": 0.6 },
      { "phrase": "у вас осталось всего несколько минут", "weight": 0.65 },
      { "phrase": "если вы ничего не сделаете сейчас, вы потеряете деньги", "weight": 0.7 },
      { "phrase": "это срочно, иначе приедет полиция", "weight": 0.75 },
      { "phrase": "ваша посылка будет возвращена в течение часа, если вы не подтвердите", "weight": 0.55 }
    ],
    "SENSITIVE_INFO_REQUEST": [
      { "phrase": "продиктуйте код, который вам только что пришёл в смс", "weight": 0.8 },
      { "phrase": "мне нужен номер вашей карты для проверки личности", "weight": 0.8 },
      { "phrase": "назовите пароль, чтобы я мог исправить проблему", "weight": 0.85 },
      { "phrase": "подтвердите дату рождения и номер счёта", "weight": 0.65 },
      { "phrase": "какой шестизначный код отображается на вашем телефоне", "weight": 0.8 }
    ],
    "INSTITUTION_IMPERSONATION": [
      { "phrase": "я звоню от имени вашего банка", "weight": 0.4 },
      { "phrase": "это налоговая служба", "weight": 0.45 },
      { "phrase": "я сотрудник полиции и мне нужно проверить вашу личность", "weight": 0.55 },
      { "phrase": "это ваш оператор связи, ваш номер будет заблокирован", "weight": 0.45 },
      { "phrase": "мы служба безопасности вашего банка", "weight": 0.5 }
    ]
  },
  "legitimateContextAllowlist": [
    { "phrase": "я звоню из больницы по поводу вашего родственника", "dampens": "FABRICATED_URGENCY", "dampenFactor": 0.55 },
    { "phrase": "это дежурный врач", "dampens": "FABRICATED_URGENCY", "dampenFactor": 0.5 },
    { "phrase": "я ваш менеджер по персоналу", "dampens": "TRUST_BUILDING", "dampenFactor": 0.5 },
    { "phrase": "это по поводу вашего собеседования", "dampens": "FABRICATED_URGENCY", "dampenFactor": 0.5 },
    { "phrase": "я звоню из вашего обычного отделения, где у вас назначена встреча", "dampens": "INSTITUTION_IMPERSONATION", "dampenFactor": 0.6 }
  ],
  "keywordSignals": {
    "SENSITIVE_INFO_REQUEST": [
      {
        "weight": 0.7,
        "groups": [
          ["отправь", "отправьте", "скажи", "скажите", "продиктуй", "продиктуйте", "подтверди", "подтвердите", "назови", "назовите", "перешли", "пришли", "пришлите", "просит", "просят", "требует", "требуют", "запрашивает", "запрашивают"],
          ["код", "пароль", "cvv", "номер карты", "секретный код", "код подтверждения", "пин-код", "пин код"]
        ]
      },
      {
        "weight": 0.5,
        "groups": [
          ["код подтверждения", "секретный код", "пин-код", "cvv", "номер карты"]
        ]
      }
    ],
    "FABRICATED_URGENCY": [
      {
        "weight": 0.3,
        "groups": [
          ["немедленно", "прямо сейчас", "в течение часа", "осталось несколько минут", "будет заблокирован", "будет приостановлен"]
        ]
      }
    ],
    "INSTITUTION_IMPERSONATION": [
      {
        "weight": 0.2,
        "groups": [
          ["банк", "налоговая", "полиция", "оператор связи", "служба безопасности", "пенсионный фонд", "служба поддержки"]
        ]
      }
    ]
  }
}
